id,text,type
768306420907466752,All the @crocerossa emergency centers are mobilized at national level. Local volunteers are supporting affected people #earthquake,1
768313152098410496,Volunteers from @crocerossa are helping people stay safe after a big #earthquake has struck in central #Italy.,1
768447390047014912,We are heartbroken by the images emerging from Italy. The Salvation Army is working with the Italian government... https://t.co/kFUsaNhevS,1
768625953794764801,"Deadly earthquake rocks central Italy, Army mobilized in rescue https://t.co/8uBlGG7Uud via @nbcnews/ OUR PRAYERS ARE WITH YOU !",1
768661057795661824,"AT&amp;T, T-Mobile, and Verizon waive fees following earthquake in Italy

Earlier today, a mag… https://t.co/srRWaxqOIw https://t.co/BSCgdtxU9z",1
768796452428484610,Chabad in Italy Offers Assistance to Earthquake Victims - Arranging volunteers from the local Jewish community... https://t.co/RDtykIAh7K,1
768611378227654656,"Army, Rescuers Race to Save Survivors of Italy Quake https://t.co/uR0jp97gTR https://t.co/oK944zaUBX",1
768662043004170240,"@Gurmeetramrahim 
 Earthquake in Italy!  @derasachasauda volunteers, save the life Papa g .all.r your children .help them.",1
768671914982203392,@potus are we sending any support to Italy quake victims? The Republic of California has trained resources who can help. Get off your ass.,1
768584656388173824,"Army, Rescuers Race to Save Survivors of Italy Quake: The 6.2 magnitude quake struck about 100 miles northeast of Rome and killed at ...",1
768536876823224320,Earthquake blanket https://t.co/Nh2QwgQsnn,1
768537578874277888,20 asylum seekers from a regional centre went to help the civil protection team  #earthquake #Italy https://t.co/WRcAo2Nmwq,1
768750478679093248,Football stadium becomes a makeshift hospital and rescue centre after Italy earthquake devastation: Mirror Chief… https://t.co/md7AnTpYqU,1
768739298589933568,We have a collection of resources and evidence related to health and #earthquake - https://t.co/Ls3AscsllQ @CochraneLibrary #ItalyEarthquake,1
768821576154378240,"Packages, containing #medicalsupplies like Tylenol &amp; aspirin, will help victims of the earthquake recover: https://t.co/qwKC61Cjfa",1
768672980247326720,PSA: Telstra and Optus are offering free calls to Italy following yesterday’s earthquake https://t.co/mrd9nU8Hp6,1
768848577225428992,"Italy quake - Young girl found alive under rubble, but at least 240 dead. ShelterBox team has arrived in country. https://t.co/IMw7GLStFt",1
768835897173291010,BERGOGLIO’S GIFT TO THE VICTIMS OF THE EARTHQUAKE: VATICAN FIREFIGHTERS IN AMATRICED https://t.co/AzfQGccroO https://t.co/mzsPsy0EUh,1
768687735792033792,@misaelfresz Rescuers Search for Survivors in Italy Quake That Killed 247: Rescue crews using bulldozers and their bare h...  @jesusfresz,1
768669008195235840,"Italy quake kills 159 as rescuers race to find survivors: ACCUMOLI, ITALY: Rescuers worked into... https://t.co/xSoj8x8B9G &lt;--Full Story",1
768827171494203392,CS Monitor - Thousands of workers join efforts to find Italy earthquake survivors https://t.co/4srpwT4kVu,1
768532846256488448,"T-Mobile makes calls, texts from U.S. to Italy free in aftermath of deadly earthquake https://t.co/KguBh7RjFc (via @NewsfusionApps #Tech New",1
768810763423092738,#Telstra offers free calls to Italy in wake of earthquake. Read more: https://t.co/BYWGnwLeLs $TLS,1
768652868215635969,#Italy’s Jewish community pledges aid to areas hit by #earthquake; Have set up blood donation center @ZOA_National  https://t.co/0h2vB91IcR,1
768819984780894208,"The amazing charity I work for, Team Rubicon UK has a team of qualified medics en route to Italy following the rec… https://t.co/xyjRkEnauK",1
768629284625788929,"Let's pray for + Italy + .. &gt;&gt; RT: Deadly earthquake rocks central Italy, Army mobilized in rescue https://t.co/ebwicbuhxF via @nbcnews",1
768574812474085376,"一人でも多くの方が助かりますように。 #ItalyEarthquake 
&gt;Deadly earthquake rocks central Italy, Army mobilized in rescue https://t.co/pvzeGJecqT @nbcnewsから",1
768737582800928770,"#Earthquake Collection efforts taking place in #Florence today from 10am-10pm (asking for clothes, shoes, water) https://t.co/BVq2ADfSo4",1
768661566170406912,Rescue workers race to find Italy quake survivors https://t.co/iDdZrnp2g1 [via @France24_en],1
768712022427045888,Italy Earthquake: Tent Camp For Displaced People (IT SKYTG24) https://t.co/YnZhw0LLrt https://t.co/Hy4BcIij2B,1
768835011416129536,#ItalyEarthquake: The Salvation Army Italy is making plans to respond to the 24 August quake https://t.co/W5OSr6Hloe https://t.co/ncDH5LjZqq,1
768591078018715648,"#Italy #Earthquake
#Tuscany region sending to the scene additional tents for 250 u + Light trailers &amp; ambulances https://t.co/lreIsCKfsf",1
768819079922585600,ARRL: Amateur Radio Volunteers Assisting in Italian Earthquake Response: Radio amateurs are taking part in th... https://t.co/tzBX4JYoCU,1
768548116752498689,"#TMobile makes calls, texts from U.S. to Italy free in aftermath of deadly earthquake. Read more: https://t.co/1MtSVthSDc $TMUS",1
768683638837878784,business: Death toll of Italy’s quake rose to 247 and rescue crews are searching for survivors … https://t.co/3FZ1Lbjn7i,1
768724470676590592,"#AT_T, #T_Mobile, and Verizon waive fees following #earthquake in #Italy https://t.co/vYWQ6fKRpY",1
768531692189548544,"#ItalyEarthquake We are sending food, water, and medicine to survivors of the 6.2 Magnatude earthquake ❤👍 @RedCross https://t.co/SLRFnTFjxb",1
768802267042578432,Rotary is sending Shelterboxes to provide emergency accommodation to victims of Italian earthquake.  @ShelterBox @shelterboxpress,1
768604463808458752,CBC TORONTO: 'Calls are coming in from everywhere': Torontonians sending aid to Italian earthquake zone https://t.co/ejQ3AGI3xQ,1
768668222627336192,"Verizon is offering free wireless and wireline calling from  the U.S. to Italy

https://t.co/TD164VqsRd",1
768590960716500992,"@FoxNews Pope sent his Vatican fire fighters to Italy's earthquake victims, Grazie, Gracias, thank! you. Heaven Sent.",1
768793828723716096,#survival #wild Survival tool First aid kit emergency bag earthquake first aid bag https://t.co/LGbuq36QKp https://t.co/hO1NyscBrn,1
768707653673578498,People gathered this morning in Rome to donate blood for the injured #earthquake  https://t.co/8WtAiuAvSZ,1
768832259256311808,"Housing, safety checks, free calls - ways #tech firms are helping Italian #earthquake #rescue efforts https://t.co/dyIxUdwjA8",1
768769857009704960,From Radio-Canada's team in Italy; tents erected in Amatrice for survivors of Wednesday's quake: https://t.co/VBNqFR5TIw,1
768749892873445376,"a man is seen in front of a tent in a temporary shelter for the #earthquake victims in #Amitrice , #Italy . https://t.co/KCpsPbbMcb",1
768528478526242816,Emergency aid from Hungary https://t.co/ocYbruD3Tk https://t.co/aokugEBwa9,1
768641607692353536,T-Mobile offering free calling and texting to Italy following earthquake - TmoNews https://t.co/hsBHjYes3n,1
768618345683968000,"Death toll rises to 159, over 360 injured after deadly earthquake rocks central Italy, Army mobilized in rescue https://t.co/ErO6i67gqB",1
768721833143087104,"The aftershocks woke residents of the devastated region, many of them sleeping in tents or cars. https://t.co/0hasR1agLp",1
768800256922382336,"ProgressiveArmy: RT TheBpDShow: 6.2 Earthquake in Amatrice, Italy: https://t.co/58rgdxMVWJ via YouTube",1
768577739414704128,My beautiful friends in Italy are taking food to animals near the epicentre. Pls help them by donating  https://t.co/BnSsfx0VEQ #Earthquake,1
768574365944324096,"GRAZIE! or GRACIAS! thank! you HOLY SEE! for sending over your Vatican fire fighters to help Italy's earthquake victims, Heavenly!!",1
768575191198806016,volunteers from everywhere in Italy are reaching the area of earthquake to help. We show our best in tragedies. 🇮🇹❤️😒😭,1
768557253100244992,"""Cornwall charity ShelterBox sends relief team to Italy earthquake...""  https://t.co/zGTWyconFG #cornwall #feedly",1
768630207351623681,My thoughts go out to the people of Italy who have suffered a devastating earthquake @Telstra free calls to Italy  https://t.co/vNHc6mJVjD,1
768836232512212992,"#BERGOGLIO’S GIFT TO THE VICTIMS OF THE #EARTHQUAKE: #VATICAN FIREFIGHTERS IN AMATRICE
https://t.co/AzfQGcu2No via @In Terris - News on line",1
768844645824466944,Pope Dispatches Vatican Firefighters To Help In Italy Earthquake Rescue: Pope Francis on Wednesday dispatched... https://t.co/UjWKwyB4CS,1
768532750173294592,ShelterBox assessment team deploys to Italy: ShelterBox assessment team en route after 6.2 earthquake in cent... https://t.co/fEVMjb581M,1
768755845085536256,#OrderofMalta activated a mobile unit assistance to aid those in #Amatrice #ItalyEarthquake https://t.co/7qLBk0oP1c https://t.co/CwRBw48hnL,1
768668945742049281,Rescuers search for survivors in Italy quake that killed 159 (AP) Do relief supplies include pet items? #PetRelief  https://t.co/UHj6Be3dcr,1
768755700340228097,Rethinking #Resilience: Capacities of Relief Staff &amp; #Volunteers in Disaster Zones | https://t.co/bMNUZKf6Ze #WRR2016 #DRR #NGO #earthquake,1
768568471894560768,"Deadly earthquake rocks central Italy, Army mobilized in rescue https://t.co/Fjd0ZskxHm via @nbcnews  SUCH SAD NEWS",1
768765828925943808,US @verizon phone customers can call family/friends in Italy for free. #ItalyEarthquake @jnels https://t.co/USco9UmFuw,1
768801811323097088,Chabad-Italy Offers Assistance to Earthquake Victims - Arranging volunteers from local Jewish community and Israel - https://t.co/gcF2yGcbry,1
768575234517630976,"Deadly Italy earthquake: Accumoli and Amatrice in ruins; 
Army mobilized in rescue~
via @nbcnews
https://t.co/3cmPZEWWUX",1
768624023941029888,@crocerossa Trying to obtain information on volunteer opportunities towards earthquake relief. Could you DM or provide an e-mail address?,1
768662818707034112,Italy Quake Kills 159 as Rescuers Race to Find Survivors | https://t.co/j3rgOw1tet | Outlook Wires,1
768729948651532288,"Some 1,200 people spent the night in tents after the earthquake in Italy https://t.co/q2U0aiGvaJ https://t.co/ozZCWjNqxU",1
768703895682113536,"Italy quake. Young girl found alive under rubble, but at least 247 dead. ShelterBox team arriving today. https://t.co/fqgE5H4b1z",1
768768668863987712,Free Airbnb shelter for earthquake survivors https://t.co/cX2l9xFZkF https://t.co/9bXx79wYFI,1
768819701891805185,"Lt. Colonel Tursi, Officer Commanding Italy &amp; Greece, works with authorities to see how The Salvation Army can help after Italy earthquake.",1
768735897982496768,"#terremoto For helping victims of the #earthquake: blankets, food, basic goods https://t.co/HwxosDfqS8",1
768757554260443136,"Android Police: AT&amp;T, T-Mobile, and Verizon wave fees following earthquake in Italy ... https://t.co/Tq5XitX6Zw",1
768816702956113924,"Italy quake - people sleeping outdoors, in cars, in tents. ShelterBox team in place, making plans to help.",1
768666992031117312,Italy quake kills 159 as rescuers race to find survivors https://t.co/Hy6cUoh8bT via @TOIWorld God help the needy one..All be safe....,1
768812066274578432,"""Amateur Radio Volunteers Assisting in Italian Earthquake Response"" https://t.co/KbyqaJGSq8 #amateurradio #feedly",1
768839641520824321,Salvationist: The #SalvationArmy is preparing to assist people in need after devastating #ItalyEarthquake: https://t.co/Rocow9nxoq,1
768568768406560769,"Italy Earthquake: Death toll rises to 159, Army Mobilized, Dozens Buried in Amatrice - NBC News https://t.co/L8uykmjPx0",1
768888657847717888,@IAPOvoice just met cool disaster response team medics going 2 #Italy #earthquake v salute u https://t.co/DWGgRteHPq https://t.co/tJcv36xwGm,1
768922195884068864,"Emergency earthquake kit preparers, what are your favorite food items? Right now, we would be living on water and granola bars. Thanks!",1
768859561168023553,"Photo: Asylum seekers volunteer to assist in Italy earthquake rescue mission - @Radio1Rai via @breaking
https://t.co/Qu919pPMKn",1
768915808005136388,"Tent cities setup northeast of Rome after earthquake in Italy, at least 241 dead: AMATRICE, Italy -Rescue cre... https://t.co/pXltVZVHfg",1
768925914289704960,#ItalyEarthquake @WHO @crocerossa Field guide for crush injuries in earthquakes for medics (for print/distribute) RT https://t.co/8nGSvCpfQe,1
768953046726434816,Free calls to Italy in the wake of earthquake https://t.co/MQ3Unm6P20,1
768853052036177921,Cornish aid workers from @ShelterBox arrive in Italy earthquake zone: https://t.co/7aqnjO1QKE https://t.co/TB8TezThEG,1
768920839597195265,Volunteers flock to central Italy to aid in rescue efforts after earthquake - Perspectives Daily https://t.co/WQGmx1Mbc3,1
768924851365040128,"Following earthquake, @comcast offers customers free calls and texts to Italy.https://t.co/qolcOBbcLi",1
768873438672855040,Asylum seekers volunteer in wake of Italian earthquake https://t.co/eVBujIuS0g,1
768892831704363008,#Asylumseekers - Asylum seekers volunteer in wake of Italian earthquake https://t.co/i4dm532POu,1
768902814382764033,The Salvation Army International - The Salvation Army in Italy Prepares Earthquake Response https://t.co/3mK3YnIgbO,1
768906567701831680,Italy has reacted with unprecedented solidarity to the earthquake. Too many people reached the concerned areas and too much food was donated,1
768888082510651392,"Antonio Putini, 97, sleeps with his dog in a temporary shelter set up in a gymnasium in Amatrice, central Italy, ... https://t.co/haHdMRIne5",1
768854384319066112,"Despite the risks faced from the aftershocks of the earthquake in #Italy, our team is on the ground distributing aid https://t.co/NRQj42QSil",1
768919887972446208,Comcast Provides Free Calls to Italy Following Earthquake https://t.co/LXnoehWOC8,1
768961034702852096,"""Italy: Refugee volunteers help earthquake rescue effort in Amatrice""  YouTube  https://t.co/NxcTlvR3Xi",1
768919220130152448,"Call now, check on your loved ones - Optimum customers: free calls to Italy after quake https://t.co/hDcFuL1Sfs via @dailyrecord",1
768848802769833984,SALISBURY: Disaster relief volunteers head out to earthquake-hit Italy https://t.co/3jRxj55JGq #Wiltshire,1
768910608980992000,"The very best of Italy. More than 5,000 among firefighters, law enforcement and voluntary rescuers. 

#earthquake  https://t.co/heg0xFtEH6",1
768978828639305728,"##Italy: Makeshift camp set up for Pescara del Tronto quake victims https://t.co/HaLlbWKsFh
#Video, VideoNews, news, ruptly, Video), world",1
768886844352237569,#ICYMI: Team Rubicon UK has an assessment team of medics en route to Italy. More information: https://t.co/0cWWw5IEEd #ItalyEarthquake,1
768958014745444356,Amateur Radio Volunteers Assisting In Italian Earthquake Response: https://t.co/cYYnV8X8VE,1
768959512472530945,#ItalyEarthquake: #SalvationArmy is making #DisasterRelief plans for #earthquake #victims https://t.co/xVP5zrrYJV https://t.co/zYNvhCe8VQ,1
768902930049007616,"#wfxg Asylum seekers volunteer in wake of Italian earthquake: In Arquata del Tronto, about 20 young residents... https://t.co/PlMrjN5qc2",1
768853321822179329,"Israel has elite search, rescue teams, field hospital on standby. Why refuse manpower when minutes matter?
https://t.co/hNvNHSVLmL
@ItalyMFA",1
768878589064253441,"Team Rubicon UK has an assessment team of veterans, all qualified medics, en route to Italy
https://t.co/Gfdc0UTxen",1
768889542040518656,"##Italy: Refugee volunteers help earthquake rescue effort in Amatrice https://t.co/kpFZIQ72A8
#Video, VideoNews, news, ruptly, Video), wor…",1
768422057847746560,"Update: A man is rescued alive from the ruins following an earthquake in Amatrice - Army mobilized,  https://t.co/jWLTWFXlVu",1
768419570923298816,"A @ShelterBox response team will be in Italy within 24 hours, to assess the need for emergency shelter in Italy after today's #earthquake.",1
768397122458845184,"Tents have arrived in #Amatrice so the 2,500 displaced people have somewhere to spend the night https://t.co/eGEBHwoHS6 #terremoto",1
768288931158695937,"Actions does more than thoughts or prayers! Like donating blood, food, water and shelter. #ItalyEarthquake #Italy #Earthquake",1
768479410571706370,Plumbers working 24/7 to restore water service to areas of Italy affected by the earthquake. https://t.co/YAfK4oBmIv,1
768405087051976704,The Italian gvt waited 10 HOURS to send the army to help the villages where the earthquake hit,1
768465917068111872,Alice Pettway on working with @AllHands Volunteers and the Ecuador Earthquake Response. https://t.co/nbopQfw9sj https://t.co/PI9qoSko1Y,1
768412466850177024,We are already trying to gather some stuff for the people affected by the #earthquake #terremoto like food and clothes,1
768318222315687936,Search and rescue dogs &amp; 20 ambulances on the ground in #Perugia following #earthquake volunteers from @crocerossa on the scene.,1
768482309943152640,"Praying for Italy. Devastating... Deadly earthquake rocks central Italy, Army mobilized in rescue https://t.co/10n1Upkq5Z via @nbcnews",1
768482955513716736,Vatican firefighters to help Italy quake: Pope Francis has dispatched one-sixth of the… https://t.co/KKodqOzPzA,1
768440302789091328,"Italy earthquake: Army mobilized, dozens buried in Amatrice + Photos https://t.co/6fA30wEhND",1
768455236583362560,"ITALY EARTHQUAKE, AUG. 24, 2016

2 tent cities totaling about 50 tents being set up for quake victims in Italy's... https://t.co/W6B2s5p5TH",1
768432971628118017,"ITALY EARTHQUAKE UPDATE:
@ShelterBox to send team to disaster zone where dozens have died
https://t.co/4hW3vzViw6 https://t.co/HbveGhbyJa",1
768502298888724480,"At least 120 dead, 368 injured: Deadly earthquake rocks central Italy, Army mobilized in rescue https://t.co/3DBZGEmG02 via @nbcnews",1
768436223585185792,First aid to victims #Italyquake of partner @CaritasItaliana on its way. How you can support https://t.co/kuPdP8y6cb https://t.co/OAOUQVai0O,1
768504712102547456,Death toll rises to 84 in Italy - The Italian army has been mobilized to aid earthquake-affected areas. https://t.co/Ez6X9LAnl7,1
768325132897099776,"Emergency contact information distributed by the Italian Red Cross #Terremoto (@crocerossa ) #Amatrice 
#Earthquake https://t.co/o1l15vnjsZ",1
768425195199721473,#Israel's PM #Netanyahu offers #Italy #aid and rescue help after strong #earthquake. https://t.co/GDeykr4Te8 https://t.co/ZPI9UFml37,1
768491516776050688,ShelterBox sending relief team to Italy earthquake disaster zone https://t.co/e3tVYymyPO,1
768358083177418753,Red Cross search and rescue teams help survivors amid rubble after #Italy #Earthquake. @crocerossa @Federation https://t.co/t9Yvzx7wqp,1
768484394298290177,Pope dispatches Vatican firefighters to help in Italy quake rescue: Pope Francis on Wednesday ... https://t.co/G08FfEpTot (via GMA News),1
768427476469051392,"Deadly earthquake rocks central Italy, Army mobilized in rescue https://t.co/Cw7JVW6jeh Our thoughts&amp;prayers with the people in that region",1
768412294900441088,"#BREAKING: 6.2 #ItalyEarthquake has killed 37
2,500 displaced
#France ready to help army #rescues https://t.co/iUFxblAZAM",1
768392022717759488,"Italy Earthquake: Army Mobilized, 37 Killed https://t.co/r6XbFjbqLH",1
768448747097452545,2 tent cities totaling about 50 tents being set up for quake victims in Italy's central Marche region - ANSA,1
768455198264045568,"In Amatrice, Italian @RedCross volunteers continue to support &amp; help those affected by the earthquake @crocerossa https://t.co/7f0gHsQ1Ew",1
768359451397132289,Army is mobilized on earthquake zone #terremoto https://t.co/CJ2k3NZ559,1
768458869920165888,ShelterBox assessment team en route after 6.2 magnitude earthquake struck central Italy.,1
768366800744673280,"#Earthquake #Italy 
Rieti hospital. People queue up to give blood to wounded (photo @daniele_dav).
#Humanity https://t.co/KBPeSVLCxu",1
768435745455341569,Italy Red Cross still searching for survivors: Tommaso Della Longa of the Italian Red Cross tells CNN's Isa S... https://t.co/4m2ctdueQN,1
768434917902540800,Photo: Italian Red Cross teams assist with rescues after a 6.0-magnitude earthquake in central Italy - @Francescorocca via @Breaking,1
768486394910089216,"Italy - Rotary partners sorting transp &amp; accom for incoming SBox team of 3 tmrw. Arr Rome, then on to quake zone. https://t.co/KDBfv134ns",1
768495779350589440,"Italy Earthquake: Army Mobilized, Dozens Buried in Amatrice:                                 by Alexander Smi... https://t.co/ECTH0fXdIn",1
768450033742118912,"Death toll from #Italyearthquake rises to 73, thousands homeless, army called in to move rubble https://t.co/9nPgmQqWHl",1
768449513472266240,Shelterbox sends team to Italy to help earthquake rescue operation. More here: https://t.co/Vr87LRcJsJ via @BBCNews,1
768337549945245696,Italian Red Cross volunteers are on the ground supporting people affected by the recent earthquake.  https://t.co/wvMegMxU8c,1
768466111738314755,"@3D2B will be collecting items for #earthquake victims; blankets, coats, jackets, shoes, toys etc; info:https://t.co/btmVbYyllq #ioterremoto",1
768407796337479680,"#ItalyEarthquake: Church sends aid, @CaritasItaliana volunteers in #Rieti deliver food and basic necessities https://t.co/UWt7me4W1t",1
768390430207647744,ShelterBox team to Italy within 24 hrs. Ready to help after quake. In touch with Rotary and affiliate colleagues. https://t.co/v5RdWh42BS,1
768391873786290176,"Italy Earthquake: Army Mobilized, 37 Killed: An earthquake hit central Italy early Wednesday, collapsing home... https://t.co/NpSIhiyrll",1
768443206895828992,"Photo: Water collected for earthquake victims, in Rieti, Italy - Rieti Life via Facebook via @Breaking",1
768502054893424640,AT&amp;T provides free texting and calls to Italy after earthquake - https://t.co/qLM2SYT7nY https://t.co/XOCkOB1hTk,1
768447896240943104,Death Toll From Italian Quake Rises To 38; Army Mobilized As Dozens Remain Buried Under Rubble #Italy https://t.co/T6PYdWNKZu,1
768323535588696064,#Italy #RedCross @crocerossa emergency centrs mobilized. #volunteers support affected by #earthquake @roteskreuz_de https://t.co/GofFpJvHzy,1
768509338147098624,#Pope #Catholics Pope dispatches Vatican firefighters to help in Italy quake rescu...: Earli... https://t.co/GJd3t7SJbX #UniteBlue #Tcot,1
768499846126903296,Relief groups are mobilizing to aid victims of the #ItalyEarthquake Here’s how you can help https://t.co/lQoVEsh0KP https://t.co/92QnFRPrNr,1
768494528378449920,Keeping the families &amp; community impacted by the earthquake in our prayers. Free calls &amp; texts from the US to Italy…https://t.co/tuREM7TkSk,1
768479275166994432,So glad that IFRC are bringing dogs: fastest way to find survivors. Red Cross rescuers join hunt for quake survivors https://t.co/SntNjcbqvN,1
768488362353098752,Pope dispatches Vatican firefighters to help in Italy quake rescue - Daily Mail -- 15:24 https://t.co/0VqSsinCcs,1
768389483335028736,"(NBC 5 Dallas Fort Worth) #Italy #Earthquake: Army Mobilized, Dozens Buried in Amatrice :.. https://t.co/LlyauJe2Pa https://t.co/AXsp8wc62s",1
768418420060745728,Our disaster desk is active for earthquake activity today. Volunteers are monitoring. Volunteers please report in to Skype #hmrd via ^ct,1
768431594419941376,Cyprus has offered rescue teams to Italy to aid in rescue efforts after a 6.2 magnitude earthquake #ItalyQuake... https://t.co/luBF5rnOJV,1
768464570537111552,#Refugees in #Italy volunteering in emergency rescues following earthquake #solidarity #RescueHumanity https://t.co/HEAAuL2M1r,1
768378458288353281,"#Italy Earthquake: #Army Mobilized, Dozens Buried in Amatrice - Aug 24 @ 5:24 AM ET  https://t.co/ppilSzI9Rs",1
768393091371896833,First @CaritasItaliana aid already on its way after #ItalyQuake https://t.co/IkE2eow5Hk,1
768463410262597635,"""Pope sends Vatican firemen to the scene"" https://t.co/x7UAkfGZVw",1
768435156935909376,"#Israel IDF search and rescue earthquake team on way to #ItalyEarthquake.
#IDF #Jewish #humanitarian #Aid #ADL https://t.co/lFsw3wtBTu",1
768359789931929600,Army is mobilized on earthquake zone #terremoto-Donación de sangre en hospital de RIETI https://t.co/CJ2k3NZ559,1
768500154253111296,Great Italian solidarity : queueing to donate blood for the victims of the earthquake. https://t.co/SVMKJ0EtV5,1
768354192578768896,Thanks God my friend and her family are ok.  Their house is earthquake-proof and now they are hosting who needs shelter.,1
768499185981255681,Maltese volunteers head out to help earthquake-stricken Umbria https://t.co/Yd3vfFjnV0,1
768512457954455552,"#Earthquake #Italy 
Colonel Massimo Tuzza
#Army working manually for the removal of rubble
 https://t.co/7R0OCAxTCX",1
768300446603579392,Toronto's Italian community already mobilizing to help victims of earthquake 100 miles north of Rome. Many worried about relatives.,1
768359054276108288,"'Half the town is gone' 
@ShelterBox operations team prepared to respond to a 6.2 magnitude earthquake in Italy. https://t.co/CWjajV1he4",1
768450504242425856,Italian Red Cross is on the ground with search and rescue teams and sniffer dogs after a 6.2 magnitude earthquake. https://t.co/Bujn0qPb49,1
768356256088256512,Long queues to donate blood after Earthquake strikes Central Italy.  #PrayForItaly https://t.co/mifuZNBusv,1
768453725476286464,@BBCBreaking Service call 4 #earthquake #live #free  twitter https://t.co/r6IDzq6eSG   and  #photostream https://t.co/O1m4l1Qmej,1
768367340312338432,A major earthquake has struck central Italy and Red Cross search and rescue teams are racing to help survivors... https://t.co/eiWMhEJ3Xv,1
