id,text,type
768286044605128704,"#Amatrice mayor (Rieti province close to epicentre): ""we need special units to rescue trapped people"" #terremoto #earthquake",0
768559918437789696,Italy Earthquake Emphasizes The Need For Mobile Hospitals https://t.co/Vs8pNItpQd,0
768397851386908673,"Sentivo che c'è bisogno di sangue, chi può donare aiuti! 
Blood needed for the earthquake emergency please RT!",0
768297334652350465,"#Blood, free #wifi, #ambulances &amp; #prayers is what needed NOW for #earthquake in Central #Italy #terremoto",0
768425824362127361,Italy Earthquake: 'No electricity or food' - Sabarina lives 8 miles from the epicentre https://t.co/neHftXIZnf via @audioBoom,0
768442765629722629,"Retweeted CNN International (@cnni):

The Red Cross is asking people in central Italy to turn off their wifi... https://t.co/hYhZpmQQxo",0
768400239203979264,My condolences to the people of Italy affected by this devastating earthquake. International relief assistance is needed.  Please help.,0
768502788313653248,#ItalyEarthquake guys please everyone donate as much as you can to these earthquake centers and donate blood and clothes please help out,0
768299309645254656,"Two reported dead in #arquata del tronto, people are asked to donate #blood  #amatrice #terremoto #earthquake https://t.co/x5W5xCshrp",0
768601291555688448,Italian earthquake victims asked to disable WiFi passwords https://t.co/C0Qd89ksu7,0
768580138401406976,Latest TUAW News Italian earthquake victims asked to disable WiFi passwords https://t.co/jfAOIE7iih,0
768331927011069952,Mayor of earthquake-hit Amatrice says: (1) stay off the roads near areas affected (2) go give blood if you can. #terrmoto,0
768439059442180096,6.2 earthquake devastated central Italy. Please donate to the Italian Red Cross to aid its search &amp; recovery effort https://t.co/Qwj65fV1b4,0
768492909112852480,(Wired UK):#Italian #Red Cross urges people to disable Wi-Fi passwords after devastating earthquake : A.. https://t.co/6OZmfDFnjb,0
768380171116240896,Please donate blood @ ospedale Lellis(Rieti)  #avisprovincialerieti #TerremotoItalia #earthquake #ItalyEarthquake,0
768339980913639424,Please open your WIFI to allow better communication in earthquake zones. https://t.co/dC03PC9UYY,0
768548480147161088,Italian Red Cross today requesting people in earthquake affected areas remove wifi passwords on routers to allow emergency use #EPTip,0
768371866474057728,"Can you please retweet for donations  to the Italian Red Cross for #earthquake  @TobiasMenzies , @TribeTobias ? https://t.co/O87XHGo6nR",0
768489250014662656,"@SpecialReport @ShannonBream Please help the PEOPLE in Italy. Devastating earthquake. We need to donate money, food, etc! Obama step up!",0
768395258426109952,Those in Italy who wish to show solidarity for the victims of earthquake can do so by donating blood at their nearest hospital #terremoto,0
768525046465892352,"Italy needs help! The earthquake left many people without home, hospitals need ambulances,… https://t.co/JGY7Hro511",0
768369544247271424,I'm ok. The earquake here wad minimal but we have problem with the water and shitty Wi-Fi. #earthquake #terremoto #ItalyEarthquake,0
768580329414066176,"Huuuuh, disaster orgs requesting opening wifi connections to bolster communication in the wake of Italy's earthquake https://t.co/IvBPEsX3Ar",0
768344380147138560,Also please donate blood #earthquake,0
768456114350333954,Donate blood in solidarity to earthquake victims.Please find the whole list of blood donation centers in Rome- https://t.co/yDli4ACrrj,0
768484304611454977,"""Red Cross: Turn your wi-fi password off"" https://t.co/qneEyPutC8",0
768318146000191488,Italy earthquake urgent blood donations needed #Rieti https://t.co/KWbl5HA1eG,0
768567839783473152,Italians ask for any donations for earthquake aid to be sent directly to Italian Red Cross @crocerossa #auspol  https://t.co/XVEhlTdIWn,0
768552041522135040,Red Cross requests Italians deactivate Wi-Fi router passwords to ease earthquake rescue efforts https://t.co/M853Ohmpz5,0
768681469623492608,Italian Red Cross urges locals to disable Wi-Fi passwords following devastating earthquake: The Croce Rossa t... https://t.co/uZ5EFV5kP8,0
768366578593308672,so sad for those affected by the earthquake😔😔 please donate blood !! #terremoto,0
768496350262460418,"Haven't seen this before:

The Red Cross Wants Italians in Earthquake Disaster Area to Deactivate Wi-Fi Passwords https://t.co/mIysOsmCNY",0
768581765858529281,"Italian earthquake victims asked to disable WiFi passwords, and it makes sense https://t.co/KM6rmMx2Yo",0
768509922631905280,“Locals urged to remove password from WiFi after earthquake” Mashable https://t.co/cF4bYVNReB,0
768342819043966976,Terrible earthquake in central Italy. Shocked. Our Civil Protection Department needs blood. Please help. #terremoto,0
768501059228696576,The Red Cross asks Italians to deactivate their password protection on their WiFi in the aftermath of an earthquake. https://t.co/ECIXrtMOYh,0
768408682350649344,"Foreign tourists in Rome, please see if you  can donate blood of all types for the #earthquake. https://t.co/DIGKoReJjn",0
768317536278568960,#BREAKING They are appealing for blood donations in #Amatrice #Italy after 6.2 magnitude #earthquake. @CorriereSociale,0
768489840417632257,Sharing #Technology #Startup #Founder News | Red Cross Asks Italians in Quake Zone to Disable Wi-Fi Passwords https://t.co/0V7ktdqjA5,0
768688368108601344,Italian Red Cross urges people to disable Wi-Fi passwords after devastating earthquake https://t.co/gg3hcD5fLZ &gt;&gt; Niet veilg. Wel nodig.,0
768757200634441728,« Want to help earthquake victims near you? Disable your WiFi password » https://t.co/rYaJ6ueTfc Le net c’est comme la bière : ça se partage,0
768735619195469824,Italian Red Cross: remove Wi-Fi password to help earthquake recovery. Security expert: hold on a second https://t.co/klQg0QhC1W,0
768900617045585920,Disable your WiFi passwords in times of crisis. #Louisianaflooding https://t.co/0B440jTaT9 via @thenextweb,0
768958535870799874,The Red Cross is urging Italians to turn their Wi-Fi passwords off after the earthquake: The Red Cross is urg... https://t.co/0icCzia1wM,0
768978532341014528,Donate to day to help save Victims or provide Food Water etc.... https://t.co/T4kc0zJZ7t,0
768721652091854848,Our support to all families affected by the earthquake in Italy. Donate Italian Red Cross: https://t.co/gln9IciljB https://t.co/2kb7VpXM8N,0
768717007768416256,"#help #earthquake plastic tablewear, water, detergents, long-life food #pleasedonate #everythingcanhelp https://t.co/tlbRMAAe9J",0
768858856482930688,BBC News: Earthquake rescuers seek unlocked wi-fi https://t.co/OnMJOSW1fP,0
768806059771367424,#TechnologyNews: Rescue teams searching for earthquake survivors trapped in central Italy have asked locals to unlock their wi-fi passwords.,0
768717751892533248,Italian Red Cross urges locals to disable WiFi passwords following devastating earthquake - https://t.co/LO3MrUR5dy,0
768857736486359040,Appeal for wi-fi connection in #earthquake areas in #Italy https://t.co/hdRIsdMPsl via @BBCNews,0
768705995337895936,"super interesting, small but huge #commisaid element in disaster response: turn off your wifi password https://t.co/3OLgbucPk8",0
768852021990400001,"I've really gotta get my earthquake prep game up! I need all the bottles of water, batteries, canned food, etc. #earthquakestress",0
768958970136518656,Italy quake rescuers ask locals to unlock their wi-fi# earthquake#emergency# wifi makes sense https://t.co/MVSH6xVHoZ,0
768820146085306368,BBC News Tech Italy quake rescuers ask locals to unlock their wi-fi: Rescue teams searching for earthquake su... https://t.co/TTNXsVQWdW,0
768853110483738624,"2all that asked how 2help,of course if u live abroad can't send food, but maybe clothes, blankets or money! Contact @crocerossa #earthquake",0
768792564891721728,Another way of donating if you are in Italy is to open up your wifi to allow others to use it. https://t.co/z0gyAI9KQk,0
768816836431327232,"Italy earthquake leads to open-air mortuaries, rescue teams running out of body bags,as looting spreads  https://t.co/HUArBf913e",0
768737582800928770,"#Earthquake Collection efforts taking place in #Florence today from 10am-10pm (asking for clothes, shoes, water) https://t.co/BVq2ADfSo4",0
768916182774624256,Italy Quake Rescuers Ask Locals To Unlock Their Wi-Fi: Rescue teams searching for earthquake survivors… https://t.co/IywqIQUjX4  | Slashdot,0
768820563221417984,#berita #teknologi Italy quake rescuers ask locals to unlock their wi-fi: Rescue teams se... https://t.co/2n35NLZW27 #WartaBeritaCentral,0
768799099684610048,"Red Cross urges Italians to turn off their wifi passwords. Essentially a pitch for free internet for all. 
https://t.co/Pq6CmfKisE",0
768735868219629569,Italians Urged to Remove Wifi Passwords to Help Earthquake Victims: Disaster communications. https://t.co/vARnuwXVbV,0
768850149040726018,"an alarm training button,in cage,cats push button, wifi alarm in house says, hey dummy hooman, get me out earthquake https://t.co/5lgvLrBllk",0
768809412744077312,"India needs an SOP for to override KYC for this. ""@BBCTech: Italy quake rescuers ask locals to unlock their wi-fi https://t.co/QsjbZdwPkG""",0
768783300341207041,Perugia earthquake: DONATE blood and funds. #PrayForItaly https://t.co/1A7E0F3fI2… https://t.co/gphspkL2aO https://t.co/oxYfoFj6ZA,0
768707126453764096,"RT TheNextWeb ""Want to help earthquake victims near you? Disable your Wi-Fi password https://t.co/rAQSfIwuSj https://t.co/ZAZIvhTEeq""",0
768743798461440000,The @RedCross is urging Italians to disable wifi passwords so responders and victims can communicate. #earthquake https://t.co/k9fNCjTpXz,0
768958328085049348,Italy quake rescuers ask locals to unlock their wi-fi | Short News: https://t.co/tJoOP4IyQq via @YouTube,0
768856637272576000,https://t.co/HZh6xGqe2e : Italy quake rescuers ask locals to unlock their wifi: Italy quake rescuers ask local... https://t.co/2jdIl78Tj3,0
768767120142393344,Our thoughts are with those who lost relatives and homes in #ItalyEarthquake. Please send donations @CaritasItaliana https://t.co/gubfoi1kTT,0
768745988664258560,"Donate clothes, shoes, water &amp; more in #Florence for victims of the #Earthquake, here's how and where https://t.co/OwkN9XRPP0",0
768838950140141568,"The @RedCross is urging Italians 🇮🇹 to turn their Wi-Fi #passwords off after the earthquake.
Via @businessinsider 

https://t.co/kg2msbKR7u",0
768944692889124864,"Italian Red Cross asks residents to unlock their wifi to aid in search and rescue after (terrible) earthquake 

https://t.co/WFq025mHR4",0
768817716996308992,"The #ItalyEarthquake has caused significant damage. Survivors need your help to access food, water, and medicine. https://t.co/Wkwp12obuW",0
768808279610884096,Red Cross asks Italians in earthquake disaster area to turn off Wi-Fi passwords  https://t.co/9fRHxWATtD,0
768890150524903424,@omertaricerca Well right now donating to the victims of the earthquake.. sent some mails to try and get the medicines. No answer so far.,0
768759688288727040,"Earthquake in central Italy, 247 dead so far. Blood donations needed: https://t.co/pjN7pRxnlX",0
768817709945610240,"Survivors of the magnitude 6.2 quake in #Italy seek shelter, left homeless. https://t.co/3t8UQTnfbS",0
768765233519296512,The simplest things mean a hell of a lot. Disable wifi in this and other situations: https://t.co/KA3BlVXPKK   #disablewifi,0
768948638240350208,Red Cross call on Italians to turn Wifi passwords off following earthquake https://t.co/To79ZGljgO,0
768902851959500800,"When mudslides &amp; earthquakes bury people, dogs rescue teams &amp; medical teams need to be immediately dispatched @UN https://t.co/uE8oUxmr1T",0
768823780093427712,The Red Cross asks Italians to deactivate their Wi-Fi passwords for earthquake relief: https://t.co/ttILZmKp0X … https://t.co/LfIAJYp0Q3,0
768860982072467456,Help quake victims near you by disabling your Wi-Fi password https://t.co/cARM7CwRxd,0
768785401418919936,#PingForADay &gt; Italy asks public to off Wi-Fi passwords for communication in earthquake aftermath. https://t.co/iZNjEzwf4p #WiFi #quake,0
768744737863897088,"Public service announcement, in event of disaster, donate your wifi and disable your wifi password. https://t.co/k9fNCjTpXz #psa #earthquake",0
768758887063355392,"Survivors of the 6.2M #ItalyEarthquake need emergency supplies like food, water, and medicine — donate today: https://t.co/2wOhYLZGok",0
768811382422724608,The role of telecom in crisis - The Red Cross is urging Italians to turn Wi-Fi passwords off after the earthquake https://t.co/yaeeEqA1ay,0
768828087412875265,#Italy quake rescuers ask locals to #unlock their wi-fi https://t.co/qytDs1J8Jy,0
768784240196591616,"@RedCross Please assist in rescue efforts, food, water, shelter, to the earthquake devastated area of Amatrice in Italy.",0
768736713476800513,Italians are being urged to drop their Wi-Fi passwords to help earthquake victims https://t.co/2bgmLfhoyO https://t.co/6yh2yYUlte,0
768792105451917312,"Amatrice, home town of Amatriciana sauce, has been destroyed by an earthquake: help the locals. via /r/food #food … https://t.co/iVzt9u4YN3",0
768804859407663108,"Blood urgently needed for #earthquake patients, where to donate in #florence #tuscany @rep_firenze #PrayingforItaly
https://t.co/gbXmIK7kIB",0
768913368027533312,"PLS If You/Ur Friends/Neighbors Can HELP the PPL of AMATRICE, ITALY From recent earthquake killing hundreds W/blankets, water &amp;/or $ Pls Do!",0
768870785578598400,"How can you help in #Emergency or #NaturalDisaster situations? Unlock your #WiFi for those in need to communicate.

https://t.co/oPPaEUIXfF",0
768790575541870592,Italy earthquake: Red Cross urges locals in affected areas to disable their WiFi passwords - International Busines… https://t.co/hLHN09AOrq,0
768422057847746560,"Update: A man is rescued alive from the ruins following an earthquake in Amatrice - Army mobilized,  https://t.co/jWLTWFXlVu",1
768419570923298816,"A @ShelterBox response team will be in Italy within 24 hours, to assess the need for emergency shelter in Italy after today's #earthquake.",1
768397122458845184,"Tents have arrived in #Amatrice so the 2,500 displaced people have somewhere to spend the night https://t.co/eGEBHwoHS6 #terremoto",1
768288931158695937,"Actions does more than thoughts or prayers! Like donating blood, food, water and shelter. #ItalyEarthquake #Italy #Earthquake",1
768479410571706370,Plumbers working 24/7 to restore water service to areas of Italy affected by the earthquake. https://t.co/YAfK4oBmIv,1
768405087051976704,The Italian gvt waited 10 HOURS to send the army to help the villages where the earthquake hit,1
768465917068111872,Alice Pettway on working with @AllHands Volunteers and the Ecuador Earthquake Response. https://t.co/nbopQfw9sj https://t.co/PI9qoSko1Y,1
768412466850177024,We are already trying to gather some stuff for the people affected by the #earthquake #terremoto like food and clothes,1
768318222315687936,Search and rescue dogs &amp; 20 ambulances on the ground in #Perugia following #earthquake volunteers from @crocerossa on the scene.,1
768482309943152640,"Praying for Italy. Devastating... Deadly earthquake rocks central Italy, Army mobilized in rescue https://t.co/10n1Upkq5Z via @nbcnews",1
768482955513716736,Vatican firefighters to help Italy quake: Pope Francis has dispatched one-sixth of the… https://t.co/KKodqOzPzA,1
768440302789091328,"Italy earthquake: Army mobilized, dozens buried in Amatrice + Photos https://t.co/6fA30wEhND",1
768455236583362560,"ITALY EARTHQUAKE, AUG. 24, 2016

2 tent cities totaling about 50 tents being set up for quake victims in Italy's... https://t.co/W6B2s5p5TH",1
768432971628118017,"ITALY EARTHQUAKE UPDATE:
@ShelterBox to send team to disaster zone where dozens have died
https://t.co/4hW3vzViw6 https://t.co/HbveGhbyJa",1
768502298888724480,"At least 120 dead, 368 injured: Deadly earthquake rocks central Italy, Army mobilized in rescue https://t.co/3DBZGEmG02 via @nbcnews",1
768436223585185792,First aid to victims #Italyquake of partner @CaritasItaliana on its way. How you can support https://t.co/kuPdP8y6cb https://t.co/OAOUQVai0O,1
768504712102547456,Death toll rises to 84 in Italy - The Italian army has been mobilized to aid earthquake-affected areas. https://t.co/Ez6X9LAnl7,1
768325132897099776,"Emergency contact information distributed by the Italian Red Cross #Terremoto (@crocerossa ) #Amatrice 
#Earthquake https://t.co/o1l15vnjsZ",1
768425195199721473,#Israel's PM #Netanyahu offers #Italy #aid and rescue help after strong #earthquake. https://t.co/GDeykr4Te8 https://t.co/ZPI9UFml37,1
768491516776050688,ShelterBox sending relief team to Italy earthquake disaster zone https://t.co/e3tVYymyPO,1
768358083177418753,Red Cross search and rescue teams help survivors amid rubble after #Italy #Earthquake. @crocerossa @Federation https://t.co/t9Yvzx7wqp,1
768484394298290177,Pope dispatches Vatican firefighters to help in Italy quake rescue: Pope Francis on Wednesday ... https://t.co/G08FfEpTot (via GMA News),1
768427476469051392,"Deadly earthquake rocks central Italy, Army mobilized in rescue https://t.co/Cw7JVW6jeh Our thoughts&amp;prayers with the people in that region",1
768412294900441088,"#BREAKING: 6.2 #ItalyEarthquake has killed 37
2,500 displaced
#France ready to help army #rescues https://t.co/iUFxblAZAM",1
768392022717759488,"Italy Earthquake: Army Mobilized, 37 Killed https://t.co/r6XbFjbqLH",1
768448747097452545,2 tent cities totaling about 50 tents being set up for quake victims in Italy's central Marche region - ANSA,1
768455198264045568,"In Amatrice, Italian @RedCross volunteers continue to support &amp; help those affected by the earthquake @crocerossa https://t.co/7f0gHsQ1Ew",1
768359451397132289,Army is mobilized on earthquake zone #terremoto https://t.co/CJ2k3NZ559,1
768458869920165888,ShelterBox assessment team en route after 6.2 magnitude earthquake struck central Italy.,1
768366800744673280,"#Earthquake #Italy 
Rieti hospital. People queue up to give blood to wounded (photo @daniele_dav).
#Humanity https://t.co/KBPeSVLCxu",1
768435745455341569,Italy Red Cross still searching for survivors: Tommaso Della Longa of the Italian Red Cross tells CNN's Isa S... https://t.co/4m2ctdueQN,1
768434917902540800,Photo: Italian Red Cross teams assist with rescues after a 6.0-magnitude earthquake in central Italy - @Francescorocca via @Breaking,1
768486394910089216,"Italy - Rotary partners sorting transp &amp; accom for incoming SBox team of 3 tmrw. Arr Rome, then on to quake zone. https://t.co/KDBfv134ns",1
768495779350589440,"Italy Earthquake: Army Mobilized, Dozens Buried in Amatrice:                                 by Alexander Smi... https://t.co/ECTH0fXdIn",1
768450033742118912,"Death toll from #Italyearthquake rises to 73, thousands homeless, army called in to move rubble https://t.co/9nPgmQqWHl",1
768449513472266240,Shelterbox sends team to Italy to help earthquake rescue operation. More here: https://t.co/Vr87LRcJsJ via @BBCNews,1
768337549945245696,Italian Red Cross volunteers are on the ground supporting people affected by the recent earthquake.  https://t.co/wvMegMxU8c,1
768466111738314755,"@3D2B will be collecting items for #earthquake victims; blankets, coats, jackets, shoes, toys etc; info:https://t.co/btmVbYyllq #ioterremoto",1
768407796337479680,"#ItalyEarthquake: Church sends aid, @CaritasItaliana volunteers in #Rieti deliver food and basic necessities https://t.co/UWt7me4W1t",1
768390430207647744,ShelterBox team to Italy within 24 hrs. Ready to help after quake. In touch with Rotary and affiliate colleagues. https://t.co/v5RdWh42BS,1
768391873786290176,"Italy Earthquake: Army Mobilized, 37 Killed: An earthquake hit central Italy early Wednesday, collapsing home... https://t.co/NpSIhiyrll",1
768443206895828992,"Photo: Water collected for earthquake victims, in Rieti, Italy - Rieti Life via Facebook via @Breaking",1
768502054893424640,AT&amp;T provides free texting and calls to Italy after earthquake - https://t.co/qLM2SYT7nY https://t.co/XOCkOB1hTk,1
768447896240943104,Death Toll From Italian Quake Rises To 38; Army Mobilized As Dozens Remain Buried Under Rubble #Italy https://t.co/T6PYdWNKZu,1
768323535588696064,#Italy #RedCross @crocerossa emergency centrs mobilized. #volunteers support affected by #earthquake @roteskreuz_de https://t.co/GofFpJvHzy,1
768509338147098624,#Pope #Catholics Pope dispatches Vatican firefighters to help in Italy quake rescu...: Earli... https://t.co/GJd3t7SJbX #UniteBlue #Tcot,1
768499846126903296,Relief groups are mobilizing to aid victims of the #ItalyEarthquake Here’s how you can help https://t.co/lQoVEsh0KP https://t.co/92QnFRPrNr,1
768494528378449920,Keeping the families &amp; community impacted by the earthquake in our prayers. Free calls &amp; texts from the US to Italy…https://t.co/tuREM7TkSk,1
768479275166994432,So glad that IFRC are bringing dogs: fastest way to find survivors. Red Cross rescuers join hunt for quake survivors https://t.co/SntNjcbqvN,1
768488362353098752,Pope dispatches Vatican firefighters to help in Italy quake rescue - Daily Mail -- 15:24 https://t.co/0VqSsinCcs,1
768389483335028736,"(NBC 5 Dallas Fort Worth) #Italy #Earthquake: Army Mobilized, Dozens Buried in Amatrice :.. https://t.co/LlyauJe2Pa https://t.co/AXsp8wc62s",1
768418420060745728,Our disaster desk is active for earthquake activity today. Volunteers are monitoring. Volunteers please report in to Skype #hmrd via ^ct,1
768431594419941376,Cyprus has offered rescue teams to Italy to aid in rescue efforts after a 6.2 magnitude earthquake #ItalyQuake... https://t.co/luBF5rnOJV,1
768464570537111552,#Refugees in #Italy volunteering in emergency rescues following earthquake #solidarity #RescueHumanity https://t.co/HEAAuL2M1r,1
768378458288353281,"#Italy Earthquake: #Army Mobilized, Dozens Buried in Amatrice - Aug 24 @ 5:24 AM ET  https://t.co/ppilSzI9Rs",1
768393091371896833,First @CaritasItaliana aid already on its way after #ItalyQuake https://t.co/IkE2eow5Hk,1
768463410262597635,"""Pope sends Vatican firemen to the scene"" https://t.co/x7UAkfGZVw",1
768435156935909376,"#Israel IDF search and rescue earthquake team on way to #ItalyEarthquake.
#IDF #Jewish #humanitarian #Aid #ADL https://t.co/lFsw3wtBTu",1
768359789931929600,Army is mobilized on earthquake zone #terremoto-Donación de sangre en hospital de RIETI https://t.co/CJ2k3NZ559,1
768500154253111296,Great Italian solidarity : queueing to donate blood for the victims of the earthquake. https://t.co/SVMKJ0EtV5,1
768354192578768896,Thanks God my friend and her family are ok.  Their house is earthquake-proof and now they are hosting who needs shelter.,1
768499185981255681,Maltese volunteers head out to help earthquake-stricken Umbria https://t.co/Yd3vfFjnV0,1
768512457954455552,"#Earthquake #Italy 
Colonel Massimo Tuzza
#Army working manually for the removal of rubble
 https://t.co/7R0OCAxTCX",1
768300446603579392,Toronto's Italian community already mobilizing to help victims of earthquake 100 miles north of Rome. Many worried about relatives.,1
768359054276108288,"'Half the town is gone' 
@ShelterBox operations team prepared to respond to a 6.2 magnitude earthquake in Italy. https://t.co/CWjajV1he4",1
768450504242425856,Italian Red Cross is on the ground with search and rescue teams and sniffer dogs after a 6.2 magnitude earthquake. https://t.co/Bujn0qPb49,1
768356256088256512,Long queues to donate blood after Earthquake strikes Central Italy.  #PrayForItaly https://t.co/mifuZNBusv,1
768453725476286464,@BBCBreaking Service call 4 #earthquake #live #free  twitter https://t.co/r6IDzq6eSG   and  #photostream https://t.co/O1m4l1Qmej,1
768367340312338432,A major earthquake has struck central Italy and Red Cross search and rescue teams are racing to help survivors... https://t.co/eiWMhEJ3Xv,1
768449420849545216,"ITALY EARTHQUAKE, AUG. 24, 2016

Italian Red Cross teams assist with rescues after a 6.0-magnitude earthquake in... https://t.co/1Je31QyoSD",1
768419061210292224,Jerusalem – Israel Offers Italy With Aid And Rescue Efforts For Earthquake Ravaged Town: Jerusalem – Israel’s leader says he has offe...,1
768465822662656002,Pope sends Vatican firefighters to help rescue operation after devastating earthquake https://t.co/UySRwf8H0K... https://t.co/rXOxfr2Q9D,1
768315293487824896,"#Italy #RedCross @crocerossa deploys Relief units and Rescue dogs, 20 ambulances on their way to respond to major #earthquake @roteskreuz_de",1
768436703052922881,"ENEL mobilises 100 generators for #quake victims 

#earthquake #Italy

Via GazzettaDelSud

https://t.co/xqfB7N2HIH",1
768399993162043392,Mobile kitchens are also being set up by @crocerossa for people forced to leave their home after the earthquake in Italy,1
768332398820032512,"Active numbers of the contact center of the Civil Protection: 800840840 
Civil Protection Lazio: 803555 #earthquake",1
768444631260553216,Kudos to the Italians in line to donate blood for the earthquake victims in Amatrice. https://t.co/wtqqfE3snd,1
768416445931909121,Passing dozens of Red Cross and emergency vehicles and buses on road out of Rome to earthquake zone. #ItalyEarthquake,1
768492994039279616,We are working to bring electricity to the areas affected by the earthquake in central Italy. https://t.co/vzaGuKW9xq,1
768387630371340288,"Italy Earthquake: Army Mobilized, Dozens Buried in Amatrice - An earthquake hit central Italy early Wednesday, ... https://t.co/HO8PwhWb4G",1
768379217318907904,"Israeli PM Netanyahu offers Italy aid, search and rescue assistance after quake https://t.co/u4buYaOavm https://t.co/8mC5T8gCfx",1
